{
  "$schema": "./tokens.schema.json",
  "meta": {
    "name": "ARGOS Design System",
    "version": "0.1.0",
    "description": "Design tokens (single source of truth). Consumed by tokens.css, tokens.py, tokens.ts via scripts/build-tokens.py.",
    "reference": "greenlock.tech",
    "updated": "2026-04-15"
  },
  "color": {
    "green": {
      "50":  { "value": "#ecfdf5", "usage": "Subtle success backgrounds, active code blocks" },
      "100": { "value": "#d1fae5", "usage": "Activation-subtle backgrounds" },
      "400": { "value": "#34d399", "usage": "Decorative, subtle highlights, dark-mode accent" },
      "500": { "value": "#10b981", "usage": "CTA hover, accents" },
      "600": { "value": "#059669", "usage": "Brand primary (logo, CTAs)" },
      "700": { "value": "#047857", "usage": "Text emphasis, active links" },
      "900": { "value": "#064e3b", "usage": "Headings on light" }
    },
    "ink": {
      "50":  { "value": "#f9fafb", "usage": "Alternate page background" },
      "100": { "value": "#f3f4f6", "usage": "Zone backgrounds (cards, tables)" },
      "200": { "value": "#e5e7eb", "usage": "Dividers, default borders" },
      "300": { "value": "#d1d5db", "usage": "Subtle borders, hover borders" },
      "400": { "value": "#9ca3af", "usage": "Disabled text, light-mode footers" },
      "500": { "value": "#6b7280", "usage": "Tertiary text, placeholders" },
      "700": { "value": "#374151", "usage": "Secondary dark text" },
      "800": { "value": "#1f2937", "usage": "Secondary dark background, strong borders" },
      "900": { "value": "#111827", "usage": "Primary dark background" },
      "950": { "value": "#030712", "usage": "Maximum-contrast text on light" }
    },
    "paper": { "value": "#ffffff", "usage": "Primary light background" },
    "severity": {
      "critical": { "value": "#991b1b", "usage": "Critical finding (CVSS >= 9.0)" },
      "high":     { "value": "#c2410c", "usage": "High finding (CVSS 7.0-8.9)" },
      "medium":   { "value": "#a16207", "usage": "Medium finding (CVSS 4.0-6.9)" },
      "low":      { "value": "#365314", "usage": "Low finding (CVSS < 4.0)" },
      "info":     { "value": "#1e40af", "usage": "Informational" }
    }
  },
  "typography": {
    "family": {
      "sans": {
        "value": "Inter, ui-sans-serif, system-ui, -apple-system, \"Segoe UI\", Roboto, \"Helvetica Neue\", Arial, sans-serif",
        "usage": "UI, body"
      },
      "mono": {
        "value": "\"JetBrains Mono\", ui-monospace, SFMono-Regular, Menlo, Monaco, Consolas, \"Liberation Mono\", \"Courier New\", monospace",
        "usage": "Code, hashes, CVEs, paths"
      }
    },
    "size": {
      "xs":   { "value": "0.75rem",  "px": 12, "line-height": 1.5 },
      "sm":   { "value": "0.875rem", "px": 14, "line-height": 1.5 },
      "base": { "value": "1rem",     "px": 16, "line-height": 1.6 },
      "lg":   { "value": "1.125rem", "px": 18, "line-height": 1.5 },
      "xl":   { "value": "1.25rem",  "px": 20, "line-height": 1.4 },
      "2xl":  { "value": "1.5rem",   "px": 24, "line-height": 1.3 },
      "3xl":  { "value": "1.875rem", "px": 30, "line-height": 1.25 },
      "4xl":  { "value": "2.25rem",  "px": 36, "line-height": 1.2 },
      "5xl":  { "value": "3rem",     "px": 48, "line-height": 1.1 }
    },
    "weight": {
      "regular":  { "value": 400 },
      "medium":   { "value": 500 },
      "semibold": { "value": 600 },
      "bold":     { "value": 700 }
    }
  },
  "spacing": {
    "0":  { "value": "0" },
    "1":  { "value": "0.25rem", "px": 4 },
    "2":  { "value": "0.5rem",  "px": 8 },
    "3":  { "value": "0.75rem", "px": 12 },
    "4":  { "value": "1rem",    "px": 16 },
    "6":  { "value": "1.5rem",  "px": 24 },
    "8":  { "value": "2rem",    "px": 32 },
    "12": { "value": "3rem",    "px": 48 },
    "16": { "value": "4rem",    "px": 64 },
    "24": { "value": "6rem",    "px": 96 }
  },
  "layout": {
    "max-width-content": { "value": "72rem",  "px": 1152 },
    "max-width-prose":   { "value": "40rem",  "px": 640 }
  },
  "radius": {
    "sm":   { "value": "4px" },
    "md":   { "value": "6px" },
    "lg":   { "value": "8px" },
    "xl":   { "value": "12px" },
    "full": { "value": "9999px" }
  },
  "shadow": {
    "xs": { "value": "0 1px 2px rgba(0,0,0,0.04)" },
    "sm": { "value": "0 1px 3px rgba(0,0,0,0.06), 0 1px 2px rgba(0,0,0,0.04)" },
    "md": { "value": "0 4px 6px rgba(0,0,0,0.05), 0 2px 4px rgba(0,0,0,0.04)" }
  },
  "motion": {
    "duration": {
      "fast":   { "value": "120ms" },
      "normal": { "value": "200ms" }
    },
    "easing": {
      "out": { "value": "cubic-bezier(0.16, 1, 0.3, 1)" }
    }
  }
}
